Question,Options,Correct Option,Explanation,Topic
A cistern 6m long and 4 m wide contains water up to a depth of 1 m 25 cm. The total area of the wet surface is:,"['49 m2', '50 m2', '53.5 m2', '55 m2']",A,Area of the wet surface= [2(lb+bh+lh) -lb]= 2(bh+lh) +lb= [2 (4 x 1.25 + 6 x 1.25) + 6 x 4] m2= 49 m2.,volume-and-surface-area
"A metallic sheet is of rectangular shape with dimensions 48 m x 36 m. From each of its corners, a square is cut off so as to make an open box. If the length of the square is 8 m, the volume of the box (in m3) is:","['4830', '5120', '6420', '8960']",B,"Clearly,l= (48 - 16)m = 32 m,b= (36 -16)m = 20 m,h= 8 m.Volume of the box = (32 x 20 x 8) m3= 5120 m3.",volume-and-surface-area
The curved surface area of a cylindrical pillar is 264 m2and its volume is  924 m3. Find the ratio of its diameter to its height.,"['3 : 7', '7 : 3', '6 : 7', '7 : 6']",B,"r2h=924r=924x 2= 7 m.2rh264264And, 2rh= 264h=264 x7x1x1= 6m.2227Required ratio =2r=14= 7 : 3.h6",volume-and-surface-area
A cistern of capacity 8000 litres measures externally 3.3 m by 2.6 m by 1.1 m and its walls are 5 cm thick. The thickness of the bottom is:,"['90 cm', '1 dm', '1 m', '1.1 cm']",B,"Let the thickness of the bottom bexcm.Then, [(330 - 10) x (260 - 10) x (110 -x)] = 8000 x 1000320 x 250 x (110 -x) = 8000 x 1000(110 -x) =8000 x 1000= 100320 x 250x= 10 cm = 1 dm.",volume-and-surface-area
What is the total surface area of a right circular cone of height 14 cm and base radius 7 cm?,"['344.35 cm2', '462 cm2', '498.35 cm2', 'None of these']",C,"h= 14 cm,r= 7 cm.So,l=(7)2+ (14)2=245= 75cm.Total surface area=rl+r2=22x 7 x 75+22x 7 x 7cm277= [154(5+ 1)] cm2= (154 x 3.236) cm2= 498.35 cm2.",volume-and-surface-area
"A large cube is formed from the material obtained by melting three smaller cubes of 3, 4 and 5 cm side. What is the ratio of the total surface areas of the smaller cubes and the large cube?","['2 : 1', '3 : 2', '25 : 18', '27 : 20']",C,"Volume of the large cube = (33+ 43+ 53) = 216 cm3.Let the edge of the large cube bea.So,a3= 216a= 6 cm.Required ratio =6 x (32+ 42+ 52)=50= 25 : 18.6 x 6236",volume-and-surface-area
"How many bricks, each measuring 25 cm x 11.25 cm x 6 cm, will be needed to build a wall of 8 m x 6 m x 22.5 cm?","['5600', '6000', '6400', '7200']",C,Number of bricks =Volume of the wall=800 x 600 x 22.5= 6400.Volume of 1 brick25 x 11.25 x 6,volume-and-surface-area
"From a group of 7 men and 6 women, five persons are to be selected to form a committee so that at least 3 men are there on the committee. In how many ways can it be done?","['564', '645', '735', '756', 'None of these']",D,We may have (3 men and 2 women) or (4 men and 1 woman) or (5 men only).Required number of ways= (7C3x6C2) + (7C4x6C1) + (7C5)=7 x 6 x 5x6 x 5+ (7C3x6C1) + (7C2)3 x 2 x 12 x 1= 525 +7 x 6 x 5x 6+7 x 63 x 2 x 12 x 1= (525 + 210 + 21)= 756.,permutation-and-combination
In how many different ways can the letters of the word 'LEADING' be arranged in such a way that the vowels always come together?,"['360', '480', '720', '5040', 'None of these']",C,"The word 'LEADING' has 7 different letters.When the vowels EAI are always together, they can be supposed to form one letter.Then, we have to arrange the letters LNDG (EAI).Now, 5 (4 + 1 = 5) letters can be arranged in 5! = 120 ways.The vowels (EAI) can be arranged among themselves in 3! = 6 ways.Required number of ways = (120 x 6) = 720.Video Explanation:https://youtu.be/WCEF3iW3H2c",permutation-and-combination
In how many different ways can the letters of the word 'CORPORATION' be arranged so that the vowels always come together?,"['810', '1440', '2880', '50400', '5760']",D,"In the word 'CORPORATION', we treat the vowels OOAIO as one letter.Thus, we have CRPRTN (OOAIO).This has 7 (6 + 1) letters of which R occurs 2 times and the rest are different.Number of ways arranging these letters =7!= 2520.2!Now, 5 vowels in which O occurs 3 times and the rest are different, can be arrangedin5!= 20 ways.3!Required number of ways = (2520 x 20) = 50400.Video Explanation:https://youtu.be/o3fwMoB0duw",permutation-and-combination
"Out of 7 consonants and 4 vowels, how many words of 3 consonants and 2 vowels can be formed?","['210', '1050', '25200', '21400', 'None of these']",C,"Number of ways of selecting (3 consonants out of 7) and (2 vowels out of 4)= (7C3x4C2)=7 x 6 x 5x4 x 33 x 2 x 12 x 1= 210.Number of groups, each having 3 consonants and 2 vowels = 210.Each group contains 5 letters.Number of ways of arranging5 letters among themselves= 5!= 5 x 4 x 3 x 2 x 1= 120.Required number of ways = (210 x 120) = 25200.Video Explanation:https://youtu.be/dm-8T8Si5lg",permutation-and-combination
In how many ways can the letters of the word 'LEADER' be arranged?,"['72', '144', '360', '720', 'None of these']",C,"The word 'LEADER' contains 6 letters, namely 1L, 2E, 1A, 1D and 1R.Required number of ways =6!= 360.(1!)(2!)(1!)(1!)(1!)Video Explanation:https://youtu.be/2_2QukHfkYA",permutation-and-combination
"In a group of 6 boys and 4 girls, four children are to be selected. In how many different ways can they be selected such that at least one boy should be there?","['159', '194', '205', '209', 'None of these']",D,We may have (1 boy and 3 girls) or (2 boys and 2 girls) or (3 boys and 1 girl) or (4 boys).Required numberof ways= (6C1x4C3) + (6C2x4C2) + (6C3x4C1) + (6C4)= (6C1x4C1) + (6C2x4C2) + (6C3x4C1) + (6C2)= (6 x 4) +6 x 5x4 x 3+6 x 5 x 4x 4+6 x 52 x 12 x 13 x 2 x 12 x 1= (24 + 90 + 80 + 15)= 209.,permutation-and-combination
"How many 3-digit numbers can be formed from the digits 2, 3, 5, 6, 7 and 9, which are divisible by 5 and none of the digits is repeated?","['5', '10', '15', '20']",D,"Since each desired number is divisible by 5, so we must have 5 at the unit place. So, there is 1 way of doing it.The tens place can now be filled by any of the remaining 5 digits (2, 3, 6, 7, 9). So, there are 5 ways of filling the tens place.The hundreds place can now be filled by any of the remaining 4 digits. So, there are 4 ways of filling it.Required number of numbers = (1 x 5 x 4) = 20.",permutation-and-combination
"In how many ways a committee, consisting of 5 men and 6 women can be formed from 8 men and 10 women?","['266', '5040', '11760', '86400', 'None of these']",C,Required number of ways= (8C5x10C6)= (8C3x10C4)=8 x 7 x 6x10 x 9 x 8 x 73 x 2 x 14 x 3 x 2 x 1= 11760.,permutation-and-combination
"A box contains 2 white balls, 3 black balls and 4 red balls. In how many ways can 3 balls be drawn from the box, if at least one black ball is to be included in the draw?","['32', '48', '64', '96', 'None of these']",C,We may have(1 black and 2 non-black) or (2 black and 1 non-black) or (3 black).Required number of ways= (3C1x6C2) + (3C2x6C1) + (3C3)=3 x6 x 5+3 x 2x 6+ 12 x 12 x 1= (45 + 18 + 1)= 64.,permutation-and-combination
In how many different ways can the letters of the word 'DETAIL' be arranged in such a way that the vowels occupy only the odd positions?,"['32', '48', '36', '60', '120']",C,"There are 6 letters in the given word, out of which there are 3 vowels and 3 consonants.Let us mark these positions as under:(1) (2) (3) (4) (5) (6)Now, 3 vowels can be placed at any of the three places, marked 1, 3, 5.Number of ways of arranging the vowels =3P3= 3! = 6.Also, the 3 consonants can be arranged at the remaining 3 positions.Number of ways of these arrangements =3P3= 3! = 6.Total number of ways = (6 x 6) = 36.",permutation-and-combination
In how many ways can a group of 5 men and 2 women be made out of a total of 7 men and 3 women?,"['63', '90', '126', '45', '135']",A,Required number of ways = (7C5x3C2) = (7C2x3C1) =7 x 6x 3= 63.2 x 1,permutation-and-combination
"How many 4-letter words with or without meaning, can be formed out of the letters of the word, 'LOGARITHMS', if repetition of letters is not allowed?","['40', '400', '5040', '2520']",C,"'LOGARITHMS' contains 10 different letters.Required number of words= Number of arrangements of 10 letters, taking 4 at a time.=10P4= (10 x 9 x 8 x 7)= 5040.",permutation-and-combination
In how many different ways can the letters of the word 'MATHEMATICS' be arranged so that the vowels always come together?,"['10080', '4989600', '120960', 'None of these']",C,"In the word 'MATHEMATICS', we treat the vowels AEAI as one letter.Thus, we have MTHMTCS (AEAI).Now, we have to arrange 8 letters, out of which M occurs twice, T occurs twice and the rest are different.Number of ways of arranging these letters =8!= 10080.(2!)(2!)Now, AEAI has 4 letters in which A occurs 2 times and the rest are different.Number of ways of arranging these letters =4!= 12.2!Required number of words = (10080 x 12) = 120960.",permutation-and-combination
In how many different ways can the letters of the word 'OPTICAL' be arranged so that the vowels always come together?,"['120', '720', '4320', '2160', 'None of these']",B,"The word 'OPTICAL'  contains 7 different letters.When the vowels OIA are always together, they can be supposed to form one letter.Then, we have to arrange the letters PTCL (OIA).Now, 5 letters can be arranged in 5! = 120 ways.The vowels (OIA) can be arranged among themselves in 3! = 6 ways.Required number of ways = (120 x 6) = 720.",permutation-and-combination
Which one of the following is not a prime number?,"['31', '61', '71', '91']",D,"91 is divisible by 7. So, it is not a prime number.",numbers
(112 x 54) = ?,"['67000', '70000', '76500', '77200']",B,(112 x 54) = 112 x104=112 x 104=1120000= 7000022416,numbers
It is being given that (232+ 1) is completely divisible by a whole number. Which of the following numbers is completely divisible by this number?,"['(216+ 1)', '(216- 1)', '(7 x 223)', '(296+ 1)']",D,"Let 232=x. Then, (232+ 1) = (x+ 1).Let (x+ 1) be completely divisible by the natural number N. Then,(296+ 1) = [(232)3+ 1] = (x3+ 1) = (x+ 1)(x2-x+ 1), which is completely divisible by N, since (x+ 1) is divisible by N.",numbers
"What least number must be added to 1056, so that the sum is completely divisible by 23 ?","['2', '3', '18', '21', 'None of these']",A,"23) 1056 (45
      92
      ---
      136
      115
      ---
       21
      ---
     
 Required number = (23 - 21)    
                 = 2.",numbers
1397 x 1397 = ?,"['1951609', '1981709', '18362619', '2031719', 'None of these']",A,1397 x 1397= (1397)2= (1400 - 3)2= (1400)2+ (3)2- (2 x 1400 x 3)= 1960000 + 9 - 8400= 1960009 - 8400= 1951609.,numbers
"How many of the following numbers are divisible by 132 ?264, 396, 462, 792, 968, 2178, 5184, 6336","['4', '5', '6', '7']",A,"132 = 4 x 3 x 11So, if the number divisible by all the three number 4, 3 and 11, then the number is divisible by 132 also.26411,3,4  (/)39611,3,4 (/)46211,3 (X)79211,3,4  (/)96811,4  (X)217811,3 (X)51843,4 (X)633611,3,4  (/)Therefore the following numbers are divisible by 132 : 264, 396, 792 and 6336.Required number of number = 4.",numbers
(935421 x 625) = ?,"['575648125', '584638125', '584649125', '585628125']",B,935421 x 625 = 935421 x 54= 935421 x1042=935421 x 104=93542100002416= 584638125,numbers
The largest 4 digit number exactly divisible by 88 is:,"['9944', '9768', '9988', '8888', 'None of these']",A,"Largest 4-digit number = 9999

 88) 9999 (113
     88
     ----
     119
      88
     ----
      319
      264
      ---
       55
      ---
       
 Required number = (9999 - 55)
                 = 9944.",numbers
Which of the following is a prime number ?,"['33', '81', '93', '97']",D,"Clearly, 97 is a prime number.",numbers
What is the unit digit in {(6374)1793x (625)317x (341491)}?,"['0', '2', '3', '5']",A,Unit digit in (6374)1793= Unit digit in (4)1793= Unit digit in [(42)896x 4]= Unit digit in (6 x 4) = 4Unit digit in (625)317= Unit digit in (5)317= 5Unit digit in (341)491= Unit digit in (1)491= 1Required digit = Unit digit in (4 x 5 x 1) = 0.,numbers
Which one of the following can't be the square of natural number ?,"['30976', '75625', '28561', '143642', 'None of these']",D,The square of a natural number nerver ends in 2.143642 is not the square of natural number.,numbers
(1000)9÷ 1024= ?,"['10000', '1000', '100', '10', 'None of these']",B,Given Exp. =(1000)9=(103)9=(10)27= 10(27-24)= 103= 1000102410241024,numbers
{(476 + 424)2- 4 x 476 x 424} = ?,"['2906', '3116', '2704', '2904', 'None of these']",C,"Given Exp.= [(a+b)2- 4ab], wherea= 476 andb= 424= [(476 + 424)2- 4 x 476 x 424]= [(900)2- 807296]= 810000 - 807296= 2704.",numbers
"If one-third of one-fourth of a number is 15, then three-tenth of that number is:","['35', '36', '45', '54']",D,"Let the number bex.Then,1of1ofx= 15x= 15 x 3 x 4 = 180.34So, required number =3x 180= 54.10Video Explanation:https://youtu.be/z49OUnzTnwY",problems-on-numbers
Three times the first of three consecutive odd integers is 3 more than twice the third. The third integer is:,"['9', '11', '13', '15']",D,"Let the three integers bex,x+ 2 andx+ 4.Then, 3x= 2(x+ 4) + 3x= 11.Third integer =x+ 4 = 15.Video Explanation:https://youtu.be/_77C9YE321Y",problems-on-numbers
The difference between a two-digit number and the number obtained by interchanging the positions of its digits is 36. What is the difference between the two digits of that number?,"['3', '4', '9', 'Cannot be determined', 'None of these']",B,"Let the ten's digit bexand unit's digit bey.Then, (10x+y) - (10y+x) = 369(x-y) = 36x-y= 4.Video Explanation:https://youtu.be/7QOJjAmGVx0",problems-on-numbers
The difference between a two-digit number and the number obtained by interchanging the digits is 36. What is the difference between the sum and the difference of the digits of the number if the ratio between the digits of the number is 1 : 2 ?,"['4', '8', '16', 'None of these']",B,"Since the number is greater than the number obtained on reversing the digits, so the ten's digit is greater than the unit's digit.Let ten's and unit's digits be 2xandxrespectively.Then, (10 x 2x+x) - (10x+ 2x) = 369x= 36x= 4.Required difference = (2x+x) - (2x-x) = 2x= 8.",problems-on-numbers
"A two-digit number is such that the product of the digits is 8. When 18 is added to the number, then the digits are reversed. The number is:","['18', '24', '42', '81']",B,"Let the ten's and unit digit bexand8respectively.xThen,10x+8+ 18 = 10 x8+xxx10x2+ 8 + 18x= 80 +x29x2+ 18x- 72 = 0x2+ 2x- 8 = 0(x+ 4)(x- 2) = 0x= 2.",problems-on-numbers
The sum of the digits of a two-digit number is 15 and the difference between the digits is 3. What is the two-digit number?,"['69', '78', '96', 'Cannot be determined', 'None of these']",D,"Let the ten's digit bexand unit's digit bey.Then,x+y= 15 andx-y= 3   ory-x= 3.Solvingx+y= 15   andx-y= 3, we get:x= 9,y= 6.Solvingx+y= 15   andy-x= 3, we get:x= 6,y= 9.So, the number is either 96 or 69.Hence, the number cannot be determined.",problems-on-numbers
"The sum of the squares of three numbers is 138, while the sum of their products taken two at a time is 131. Their sum is:","['20', '30', '40', 'None of these']",A,"Let the numbers bea,bandc.Then,a2+b2+c2= 138 and (ab+bc+ca) = 131.(a + b + c)2=a2+b2+c2+ 2(ab+bc+ca) = 138 + 2 x 131 = 400.(a+b+c) =400= 20.Video Explanation:https://youtu.be/qmJ-0X8j_xQ",problems-on-numbers
"A number consists of two digits. If the digits interchange places and the new number is added to the original number, then the resulting number will be divisible by:","['3', '5', '9', '11']",D,"Let the ten's digit bexand unit's digit bey.Then, number = 10x+y.Number obtained by interchanging the digits = 10y+x.(10x+y) + (10y+x) = 11(x+y), which is divisible by 11.Video Explanation:https://youtu.be/lytJE8GqRvM",problems-on-numbers
"In a two-digit, if it is known that its unit's digit exceeds its ten's digit by 2 and that the product of the given number and the sum of its digits is equal to 144, then the number is:","['24', '26', '42', '46']",A,"Let the ten's digit bex.Then, unit's digit =x+ 2.Number = 10x+ (x+ 2) = 11x+ 2.Sum of digits =x+ (x+ 2) = 2x+ 2.(11x+ 2)(2x+ 2) = 14422x2+ 26x- 140 = 011x2+ 13x- 70 = 0(x- 2)(11x+ 35) = 0x= 2.Hence, required number = 11x+ 2 = 24.",problems-on-numbers
Find a positive number which when increased by 17 is equal to 60 times the reciprocal of the number.,"['3', '10', '17', '20']",A,"Let the number bex.Then,x+ 17 =60xx2+ 17x- 60 = 0(x+ 20)(x- 3) = 0x= 3.",problems-on-numbers
"The product of two numbers is 9375 and the quotient, when the larger one is divided by the smaller, is 15. The sum of the numbers is:","['380', '395', '400', '425']",C,"Let the numbers bexandy.Then,xy= 9375 andx= 15.yxy=9375(x/y)15y2= 625.y= 25.x= 15y= (15 x 25) = 375.Sum of the numbers =x+y= 375 + 25 = 400.",problems-on-numbers
The product of two numbers is 120 and the sum of their squares is 289. The sum of the number is:,"['20', '23', '169', 'None of these']",B,"Let the numbers bexandy.Then,xy= 120 andx2+y2= 289.(x+y)2=x2+y2+ 2xy= 289 + (2 x 120) = 529x+y=529= 23.",problems-on-numbers
A number consists of 3 digits whose sum is 10. The middle digit is equal to the sum of the other two and the number will be increased by 99 if its digits are reversed. The number is:,"['145', '253', '370', '352']",B,"Let the middle digit bex.Then, 2x= 10 orx= 5. So, the number is either 253 or 352.Since the number increases on reversing the digits, so the hundred's digits is smaller than the unit's digit.Hence, required number = 253.",problems-on-numbers
The sum of two number is 25 and their difference is 13. Find their product.,"['104', '114', '315', '325']",B,"Let the numbers bexandy.Then,x+y= 25 andx-y= 13.4xy= (x+y)2- (x-y)2= (25)2- (13)2= (625 - 169)= 456xy= 114.",problems-on-numbers
"What is the sum of two consecutive even numbers, the difference of whose squares is 84?","['34', '38', '42', '46']",C,"Let the numbers bexandx+ 2.Then, (x+ 2)2-x2= 844x+ 4 = 844x= 80x= 20.The required sum =x+ (x+ 2) = 2x+ 2 = 42.",problems-on-numbers
"Find the greatest number that will divide 43, 91 and 183 so as to leave the same remainder in each case.","['4', '7', '9', '13']",A,"Required number = H.C.F. of (91 - 43), (183 - 91) and (183 - 43)= H.C.F. of 48, 92 and 140 = 4.",problems-on-hcf-and-lcm
The H.C.F. of two numbers is 23 and the other two factors of their L.C.M. are 13 and 14. The larger of the two numbers is:,"['276', '299', '322', '345']",C,"Clearly, the numbers are (23 x 13) and (23 x 14).Larger number = (23 x 14) = 322.",problems-on-hcf-and-lcm
"Six bells commence tolling together and toll at intervals of 2, 4, 6, 8 10 and 12 seconds respectively. In 30 minutes, how many times do they toll together ?","['4', '10', '15', '16']",D,"L.C.M. of 2, 4, 6, 8, 10, 12 is 120.So, the bells will toll together after every 120 seconds(2 minutes).In 30 minutes, they will toll together30+ 1 = 16 times.2",problems-on-hcf-and-lcm
"Let N be the greatest number that will divide 1305, 4665 and 6905, leaving the same remainder in each case. Then sum of the digits in N is:","['4', '5', '6', '8']",A,"N = H.C.F. of (4665 - 1305), (6905 - 4665) and (6905 - 1305)= H.C.F. of 3360, 2240 and 5600 = 1120.Sum of digits in N = ( 1 + 1 + 2 + 0 ) = 4",problems-on-hcf-and-lcm
"The greatest number of four digits which is divisible by 15, 25, 40 and 75 is:","['9000', '9400', '9600', '9800']",C,"Greatest number of 4-digits is 9999.L.C.M. of 15, 25, 40 and 75 is 600.On dividing 9999 by 600, the remainder is 399.Required number (9999 - 399) = 9600.",problems-on-hcf-and-lcm
"The product of two numbers is 4107. If the H.C.F. of these numbers is 37, then the greater number is:","['101', '107', '111', '185']",C,"Let the numbers be 37aand 37b.Then, 37ax 37b= 4107ab= 3.Now, co-primes with product 3 are (1, 3).So, the required numbers are (37 x 1, 37 x 3)i.e.,(37, 111).Greater number =  111.",problems-on-hcf-and-lcm
Three number are in the ratio of 3 : 4 : 5 and their L.C.M. is 2400. Their H.C.F. is:,"['40', '80', '120', '200']",A,"Let the numbers be 3x, 4xand 5x.Then, their L.C.M. = 60x.So, 60x= 2400 or x = 40.The numbers are (3 x 40), (4 x 40) and (5 x 40).Hence, required H.C.F. = 40.",problems-on-hcf-and-lcm
"The G.C.D. of 1.08, 0.36 and 0.9 is:","['0.03', '0.9', '0.18', '0.108']",C,"Given numbers are 1.08, 0.36 and 0.90.   H.C.F. of 108, 36 and 90 is 18,H.C.F. of given numbers = 0.18.",problems-on-hcf-and-lcm
The product of two numbers is 2028 and their H.C.F. is 13. The number of such pairs is:,"['1', '2', '3', '4']",B,"Let the numbers 13aand 13b.Then, 13ax 13b= 2028ab= 12.Now, the co-primes with product 12 are (1, 12) and (3, 4).[Note: Two integersaandbare said to becoprimeor relatively prime if they have no common positive factor other than 1 or, equivalently, if their greatest common divisor is 1 ]So, the required numbers are (13 x 1, 13 x 12) and (13 x 3, 13 x 4).Clearly, there are 2 such pairs.",problems-on-hcf-and-lcm
"The least multiple of 7, which leaves a remainder of 4, when divided by 6, 9, 15 and 18 is:","['74', '94', '184', '364']",D,"L.C.M. of 6, 9, 15 and 18 is 90.Let required number be 90k+ 4, which is multiple of 7.Least value ofkfor which (90k+ 4) is divisible by 7 isk= 4.Required number = (90 x 4) + 4   = 364.",problems-on-hcf-and-lcm
"The greatest number which on dividing 1657 and 2037 leaves remainders 6 and 5 respectively, is:","['123', '127', '235', '305']",B,Required number = H.C.F. of (1657 - 6) and (2037 - 5)= H.C.F. of 1651 and 2032 = 127.,problems-on-hcf-and-lcm
Which of the following has the most number of divisors?,"['99', '101', '176', '182']",C,"99 = 1 x 3 x 3 x 11101 = 1 x 101176 = 1 x 2 x 2 x 2 x 2 x 11182 = 1 x 2 x 7 x 13So, divisors of 99 are 1, 3, 9, 11, 33, .99Divisors of 101 are 1 and 101Divisors of 176 are 1, 2, 4, 8, 11, 16, 22, 44, 88 and 176Divisors of 182 are 1, 2, 7, 13, 14, 26, 91 and 182.Hence, 176 has the most number of divisors.",problems-on-hcf-and-lcm
The L.C.M. of two numbers is 48. The numbers are in the ratio 2 : 3. Then sum of the number is:,"['28', '32', '40', '64']",C,"Let the numbers be 2xand 3x.Then, their L.C.M. = 6x.So, 6x= 48 orx= 8.The numbers are 16 and 24.Hence, required sum = (16 + 24) = 40.",problems-on-hcf-and-lcm
"The H.C.F. of9,12,18and21is:10253540","['35', '2525', '31400', '63700']",C,"Required H.C.F. =H.C.F. of 9, 12, 18, 21=3L.C.M. of 10, 25, 35, 401400",problems-on-hcf-and-lcm
"If the sum of two numbers is 55 and the H.C.F. and L.C.M. of these numbers are 5 and 120 respectively, then the sum of the reciprocals of the numbers is equal to:","['55601', '60155', '11120', '12011']",C,"Let the numbers beaandb.Then,a+b= 55 andab= 5 x 120 = 600.The required sum =1+1=a+b=55=11abab600120",problems-on-hcf-and-lcm
Evaluate :(2.39)2- (1.61)22.39 - 1.61,"['2', '4', '6', '8']",B,Given Expression =a2-b2=(a+b)(a-b)= (a+b) = (2.39 + 1.61) = 4.a-b(a-b),decimal-fraction
What decimal of an hour is a second ?,"['.0025', '.0256', '.00027', '.000126']",C,Required decimal =1=1= .0002760 x 603600,decimal-fraction
The value of(0.96)3- (0.1)3is:(0.96)2+ 0.096 + (0.1)2,"['0.86', '0.95', '0.97', '1.06']",A,Given expression=(0.96)3- (0.1)3(0.96)2+ (0.96 x 0.1) + (0.1)2=a3-b3a2+ab+b2= (a-b)= (0.96 - 0.1)= 0.86,decimal-fraction
The value of0.1 x 0.1 x 0.1 + 0.02 x 0.02 x 0.02is:0.2 x 0.2 x 0.2 + 0.04 x 0.04 x 0.04,"['0.0125', '0.125', '0.25', '0.5']",B,Given expression =(0.1)3+ (0.02)3=1= 0.12523[(0.1)3+ (0.02)3]8,decimal-fraction
"If 2994 ÷ 14.5 = 172, then 29.94 ÷ 1.45 = ?","['0.172', '1.72', '17.2', '172']",C,"29.94=299.41.4514.5=2994x1[ Here, Substitute 172 in the place of 2994/14.5 ]14.510=17210= 17.2",decimal-fraction
"When 0.232323..... is converted into a fraction, then the result is:","['15', '29', '2399', '23100']",C,0.232323... = 0.23=2399,decimal-fraction
.009= .01?,"['.0009', '.09', '.9', '9']",C,Let.009= .01;     Thenx=.009=.9= .9x.011,decimal-fraction
The expression (11.98 x 11.98 + 11.98 xx+ 0.02 x 0.02) will be a perfect square forxequal to:,"['0.02', '0.2', '0.04', '0.4']",C,"Given expression = (11.98)2+ (0.02)2+ 11.98  xx.For the given expression to be a perfect square, we must have11.98 xx= 2 x 11.98 x 0.02 orx= 0.04",decimal-fraction
(0.1667)(0.8333)(0.3333)is approximately equal to:(0.2222)(0.6667)(0.1250),"['2', '2.40', '2.43', '2.50']",D,Given expression=(0.3333)x(0.1667)(0.8333)(0.2222)(0.6667)(0.1250)=3333x1x56622222x12531000=3x1x5x3x 82662=52= 2.50,decimal-fraction
3889 + 12.952  - ? = 3854.002,"['47.095', '47.752', '47.932', '47.95']",D,Let 3889 + 12.952 -x= 3854.002.Thenx= (3889 + 12.952) - 3854.002= 3901.952 - 3854.002= 47.95.,decimal-fraction
The correct expression of 6.46in the fractional form is:,"['64699', '646401000', '640100', '64099']",D,6.46= 6 + 0.46= 6 +46=594 + 46=640.999999,decimal-fraction
The fraction 10127in decimal for is:100000,"['.01027', '.10127', '101.00027', '101.000027']",C,10127= 101 +27= 101 + .00027 = 101.00027100000100000,decimal-fraction
0.0203 x 2.92= ?0.0073 x 14.5 x 0.7,"['0.8', '1.45', '2.40', '3.25']",A,0.0203 x 2.92=203 x 292=4= 0.80.0073 x 14.5 x 0.773 x 145 x 75,decimal-fraction
4.036 divided by 0.04 gives :,"['1.009', '10.09', '100.9', 'None of these']",C,4.036=403.6= 100.90.044,decimal-fraction
3.87- 2.59= ?,"['1.20', '1.2', '1.27', '1.28']",D,3.87- 2.59= (3 + 0.87) - (2 + 0.59)=3 +87-2 +599999= 1 +87-599999= 1 +2899= 1.28.,decimal-fraction
"A man  has  Rs.480 in the denominations of one-rupee notes, five-rupee notes and ten-rupee notes. The number of notes of each denomination is equal. What is the total number of notes that he has ?","['45', '60', '75', '90']",D,"Let number of notes of each denomination bex.Thenx+ 5x+ 10x= 48016x= 480x= 30.Hence, total number of notes = 3x= 90.",simplification
